{
  "$schema": "https://schemas.ironicbuddha.dev/project-standards/v1/migration.schema.json",
  "schemaVersion": "1.0.0",
  "id": "migration/configuration/0.0.0-to-1.0.0",
  "documentKind": "configuration",
  "fromSchemaVersion": "0.0.0",
  "toSchemaVersion": "1.0.0",
  "operations": [
    {
      "operation": "add",
      "path": "/schemaVersion",
      "value": "1.0.0"
    }
  ]
}
